pub_date	title	venue	citation	url_slug	paper_url
01/02/2020	Hierarchical Bayesian myocardial perfusion quantification	Medical Image Analysis	"<b>Cian M. Scannell</b>, Amedeo Chiribiri, Adriana DM Villa, Marcel Breeuwer, Jack Lee."	HierarchicalBayesianMedIA	http://cianmscannell.github.io/files/HierarchicalBayesianMedIA.pdf 
11/11/2019	Deep-Learning-Based Preprocessing for Quantitative Myocardial Perfusion MRI	Journal of Magnetic Resonance Imaging	"<b>Cian M. Scannell</b>, Mitko Veta, Adriana D.M. Villa, Eva C. Sammut, Jack Lee, Marcel Breeuwer, Amedeo Chiribiri."	DeepLearningBasedPreProcessJMRI	http://cianmscannell.github.io/files/DeepLearningBasedPreProcessJMRI.pdf
27/07/2019	Deep learning-based prediction of kinetic parameters from myocardial perfusion MRI	Medical Imaging with Deep Learning	"<b>Cian M. Scannell</b>, Piet van den Bosch, Amedeo Chiribiri, Jack Lee, Marcel Breeuwer, Mitko Veta."	 DeepLearningBasedPredictionMIDL	http://cianmscannell.github.io/files/DeepLearningBasedPredictionMIDL.pdf 
01/02/2019	Robust Non-Rigid Motion Compensation of Free-Breathing Myocardial Perfusion MRI Data	IEEE Transactions on Medical Imaging	"<b>Cian M. Scannell</b>, Adriana DM Villa, Jack Lee, Marcel Breeuwer, Amedeo Chiribiri."	RobustNonRigidIEEETMI	http://cianmscannell.github.io/files/RobustNonRigidIEEETMI.pdf
19/11/2018	Importance of Operator Training and Rest Perfusion on the Diagnostic Accuracy of Stress Perfusion Cardiovascular Magnetic Resonance	Journal of Cardiovascular Magnetic Resonance	"Adriana D. M. Villa, Laura Corsinovi, Ioannis Ntalas, Xenios Milidonis, <b>Cian M. Scannell</b>, Gabriella Di Giovine, Nicholas Child, Catarina Ferreira, Muhummad Sohaib Nazir, Julia Karady, Esmeralda Eshja, Viola De Francesco, Nuno Bettencourt, Andreas Schuster, Tevfik F. Ismail, Reza Razavi, Amedeo Chiribiri"	ImportanceOfOperatorJCMR	http://cianmscannell.github.io/files/ImportanceOfOperatorJCMR.pdf 
